query	105	install ibm java on ubuntu linux. this document assumes that you might have another vendor version of java installed on your ubuntu linux system, such as openjdk or oracle java which is common when you use ubuntu linux.  first, of all we will remove and disable other vendor versions of java so there is no system conflict with multiple versions of java.let s assume you have openjdk installed on your system if so we are going to remove openjdk by issuing the following commands to remove openjdk from your system issue the following command type copy paste  sudo apt get purge openjdk   this command will completely remove openjdk jre from your system second, we will disable oracle java if it is installed by editing the  etc profile system path.in this exercise we will comment out the references to oracle java in the system wide  etc profile file i also recommend deleting the oracle java folders if you have them so they do not cause system conflicts.for example if you have oracle java installed in  usr local java follow these instructions to remove oracle javatype copy paste  cd  usr local javatype copy paste  rm  rf jdk1.7.0type copy paste  rm  rf jre1.7.0 if oracle java is installed on your system you will comment out the references to oracle java in the  etc profile, .profile or .bashrc file. for example, as root, use a text editor such as nano or gedit to edit your  etc profile. you may have a file that looks like this java home  usr local java jdk1.7.0path  path  home bin  java home binjre home  usr local java jre1.7.0path  path  home bin  jre home binexport java homeexport jre homeexport path you want to make sure you comment out the references to oracle java, using the    symbol in your  etc profile, .profile and .bashrc file so change the file to look like this   java home  usr local java jdk1.7.0  path  path  home bin  java home bin  jre home  usr local java jre1.7.0  path  path  home bin  jre home bin  export java home  export jre home  export path save the  etc profile file and exit download the ibm java 7.0 sdk and jrenote in order to download ibm sdk jre you will have to be a registered user, following the provided links from the ibm website in order to register. download the version of ibm java sdk and jre for your system architecture, in this case we are using the ibm java sdk jre for 64 bit ubuntu linux, which is ibm java sdk 7.0 0.0 linux x86 64.tgzibm java jre 7.0 0.0 linux x86 64.tgz once the ibm java sdk and jre has been downloaded you will proceed to set up a development environment for the ibm jdk and jre. create a directory to hold the ibm java sdk and jre using the following command type copy paste  sudo  s mkdir  p  opt ibm javatype copy paste  chmod  r 755  opt ibm javathis makes the directory available to all users on the system change into the download directory and copy the ibm java sdk and jre to  opt ibm java  directorytype copy paste  cd  home  your user name  downloadstype copy paste  sudo  s cp  r ibm java sdk 7.0 0.0 linux x86 64.tgz  opt ibm javatype copy paste  sudo  s cp  r ibm java jre 7.0 0.0 linux x86 64.tgz  opt ibm java next change into your ibm java directorytype copy paste  cd  opt ibm java make the compressed ibm java binaries executable for all users on the system by running the following commands type copy paste  sudo  s chmod a x ibm java sdk 7.0 0.0 linux x86 64.tgztype copy paste  sudo  s chmod a x ibm java jre 7.0 0.0 linux x86 64.tgz unpack the ibm java sdk by issuing the following commandstype copy paste  sudo  s tar xvzf ibm java sdk 7.0 0.0 linux x86 64.tgztype copy paste  sudo  s tar xvzf ibm java jre 7.0 0.0 linux x86 64.tgz the ibm sdk and the jre will unpack into a single directory called  opt ibm java ibm java x86 64 70 also, you need to edit the system wide path  etc profile in order to create a system wide path for the ibm java sdk jre on ubuntu linux. enter the following information below export path   path   opt ibm java ibm java x86 64 70 bin  opt ibm java ibm java x86 64 70 jre bin  path save the file and exit next, inform the system that ibm java sdk jre is availabletype copy paste  sudo update alternatives   install   usr bin java   java    opt ibm java ibm java x86 64 70 jre bin java  1type copy paste  sudo update alternatives   install   usr bin java   javaws    opt ibm java ibm java x86 64 70 jre bin javaws  1type copy paste  sudo update alternatives   install   usr bin javac   javac    opt ibm java ibm java x86 64 70 bin javac  1 inform your ubuntu linux system, that ibm java sdk jre must be the default java. also reload your system wide path  etc profile by typing the following command  type copy paste  . test to see if ibm java installed correctly by using the command type copy paste  java  version you should receive a message that displays java version  1.7.0 ea java tm  se runtime environment  build pxa6470 20100531 04 ibm j9 vm build2.6, jre 1.7.0 ibm j9 2.6 linux amd64 64 jvmxa6470 20100522 58582  jit enabled, aot enabled j9vm   r26 head 20100521 1457 b58494 jit dev 20100507 15747gc   r26 head 20100521 1652 b58499j9cl   20100522 58582 jcl   20100514 02 based on sun 7b76 test that your ibm java compiler works by using the command type copy paste  javac  versionyou should receive a message that displays javac 1.7.0 internalyou can also switch between different installed vendors of java, such as openjdk, oracle and ibm by using the command type copy paste  sudo update alternatives   config javamake sure you select the java directory which references ibm java and press enter.
query	106	program a vex robotics clawbot.  get the programming environment. create a new bit of code. set up the motors. code the while loop. code the wheels. code the lift. add the claw code. test and adapt your new code. feel free to play around with the code and find what works for you.
query	107	find your political standpoint. getting informed about politics. assessing your own political beliefs. choosing your affiliation in the united states brush up on your knowledge about government. ask your parents and other family members about their political leanings. learn about the history of major political parties. understand the main differences between parties. communicate with elected officials and party candidates. stay up to date on political news. take a test on the internet. follow your gut feeling. think about health care issues. consider your thoughts about education. assess your feelings about taxes and welfare. research energy and environmental issues. learn about us history and major us political parties. make a comparison sheet of republican and democratic values. consider third parties.
query	108	become a baseball writer. acquiring education and training. writing about baseball. getting a job. deciding if baseball writing is the career for you learn to write well. learn to shoot photos and video. learn about other sports. round out your knowledge. do an internship. become an expert on baseball. learn about baseball history. learn about the players. read classic sports journalism. practice your writing. consider freelance opportunities. start small when hunting for jobs. have realistic expectations. apply for positions. join the bbwaa. know your passions. be prepared to relocate. expect to work an unusual schedule. understand the travel requirements. follow your dream.
query	109	be a good orlando magic fan. give each player a catchy nickname. buy merchandise from the team store. don t leave the team after a fairly bad season, they might be better next season. go to games at amway center. diss the boston celtics, san antonio spurs, los angeles lakers, and the miami heat. watch their d league affiliate bakersfield jam. make sure you dislike the team that won the championship the year before, unless it is your own team. wear a jersey. promote the team in the off season by telling people to watch the team during the season.
query	110	become a baseball writer. acquiring education and training. writing about baseball. getting a job. deciding if baseball writing is the career for you learn to write well. learn to shoot photos and video. learn about other sports. round out your knowledge. do an internship. become an expert on baseball. learn about baseball history. learn about the players. read classic sports journalism. practice your writing. consider freelance opportunities. start small when hunting for jobs. have realistic expectations. apply for positions. join the bbwaa. know your passions. be prepared to relocate. expect to work an unusual schedule. understand the travel requirements. follow your dream.
query	111	write a ballad. coming up with a topic. writing your ballad. finalizing your ballad understand what a ballad is. pick a theme for your ballad. pick an event or tale to describe in your ballad. single out the most important elements of the plot. find a starter phrase. establish a rhythm and rhyme scheme. write the chorus. write a second verse in the same style as the first. complete the ballad using your structural template. keep in mind that some ballads, like stagger lee, can have the chorus built into each verse. note that it s not necessary to use three  or four line verses and choruses. put the ballad away once you have finished it. go back to the spots you had trouble with. read your ballad out loud. have someone else look over it. put your ballad to music  optional. 
query	112	buy beauty products on a budget. drugstore steals. save on high end beauty don t dismiss drugstore makeup as being cheap and low quality. look for foundation in the drugstore. look for a drugstore eyeshadow. find a good blush. choose mascara in the drugstore. get bronzer for the summertime. get lip colors. get concealers highlighters. get eyeliners. check the sales sections both online and in store at sephora and ulta. buy travel size items to try before committing to a full size full price product, or on items you do not use much. buy the holiday sets. use sites like groupon and hautelook for upcoming sales on higher priced merchandise, as well as keeping tabs on the company s own site for special sales, such as anniversary or friends and family sales. compare before you buy. try a dupe if you want the look but not the price. try the store brand. evaluate your routine.
query	113	be a good orlando magic fan. give each player a catchy nickname. buy merchandise from the team store. don t leave the team after a fairly bad season, they might be better next season. go to games at amway center. diss the boston celtics, san antonio spurs, los angeles lakers, and the miami heat. watch their d league affiliate bakersfield jam. make sure you dislike the team that won the championship the year before, unless it is your own team. wear a jersey. promote the team in the off season by telling people to watch the team during the season.
query	114	unlock motorola phones with windows. choose your unlock method. before unlocking your phone. download the usb drivers. backup your data. unlocking online imei unlocking services  these use your imei code to unlock your phone remotely. online cable unlocking services  many companies will sell credits for unlocking software. call your service provider and ask them to unlock the phone for you. unlock the phone yourself using software tools and a usb cable. be sure your motorola phone is gsm  global system for mobile communications . be sure your phone actually is locked. be sure your phone is fully charged. be sure your phone is unplugged from the computer. download the usb driver installer software for your phone and operating system from the motorola website  http   direct.motorola.com hellomoto nss usb drivers pc charging drivers.asp. extract the file motorola eu driver installation.msi from the driver package and run the program. click i agree and then next at the license agreement. if any warning messages appear, click continue anyway. click close to exit the wizard, once the installation is complete. you will now have a new program set in your machine. click start   all programs    motorola driver installer    motorola driver installer.exe the package will do an initial system scan or  clean . select the checkbox clean and reinstall and click the start button. click the exit button once the process is finished. plug in your phone. you can now connect to your phone using the motorola phone tools and other applications. make sure mobile phone tools is not running. download and install a p2k program. make sure the phone is still connected and no other programs are running that interact with the phone or the usb ports. the new hardware wizard should start and ask you if you want to connect to windows update. click no, not this time and next. choose install the software automatically and then next. the accessories interface will be installed and a confirmation screen will appear. click finish. the new hardware wizard will start up again. the data logging mcu interface will be installed and a confirmation screen will appear. repeat the above procedure for the test command interface and click finish the p2k drivers are now fully installed and the p2k programs should recognize your handset. download pst 7.2.3   phone programmer software. connect your phone to your computer using the usb cable. click start    all programs    motorola pst click on phone programmer. wait until the chimes stop. click file    new and wait for the new interface window to appear. click the phone book file icon, and then hit ok. in the phone model drop down menu select phone    read. the software will attempt to establish a connection over usb to your phone. eventually it will backup your phone book and show a progress bar. disconnect the phone. look for a new window that contains raw data of your contacts. select file    save to create a backup file with the extension .phb. put the file somewhere safe. be sure the phone is fully charged. be sure all the correct drivers are installed. install the flash interface device. check your bootloader version press     and start to see your bootloader version displayed on the screen. to unlock your phone you will need to be running an older version of the firmware, specifically version 7.d0. download bl 826 828 to 07d0 for v3 by archy.v2. flash the downloaded file into your phone with rsd lite. download the moto unlocking software from the link below. start your phone in bootloader mode. run the moto unlocking software, click connect and unlock. your phone will now be unlocked.
query	115	update nvidia drivers. manually updating. using the geforce experience. updating ubuntu drivers open the directx diagnostic tool. visit the nvidia geforce website. click the  drivers  tab. select your graphics card. download the latest drivers. run the installer. use system restore if the new driver causes problems. download and install the geforce experience program. allow geforce experience to update. click the  download driver  button to download an available update. click the  express installation  button. wait for the driver to install. use the system restore tool to roll back if something goes wrong. open the additional drivers window. wait for the list of available drivers to load. select the latest driver from the list. click the  apply changes  button. reboot your computer.
query	116	report zoo or circus animal abuse. reporting to the federal government. gathering evidence of abuse find the website for animal care. complete the complaint form. choose whether to report anonymously. find your own agency outside the u.s. write down your memories. get names of any witnesses. take pictures or video, if possible. keep copies of any relevant records.
query	117	win your ncaa basketball tournament pool. get the lay of the land. watch college basketball. know when to use seeding. get under the boards. take a shot. defend yourself. buck the trends. leave your loyalties at the door. if you can, pick several different brackets. trust yourself.
query	118	find cheap flights online. searching databases. using insider secrets. being flexible use an online travel agency. compare your results to a supplier website. try a metasearch engine. use various search tools. search using incognito or private browsing. book your flight 6 8 weeks in advance. use flight points. search for discounts. pick the cheapest day to fly. try a budget airline. take alternative routes. be flexible on your destination.
query	119	get a license to ship cargo from the federal maritime commission. applying for a license. gathering proof of financial responsibility read the rules and regulations. appoint a qualifying individual. apply online. get a paper application instead. complete the application. establish a presence in the united states. pay the license fee. mail the application. contact the fmc with questions. wait to hear a response. get a surety bond  u.s. based license . submit proof of financial responsibility  not u.s. based . show financial responsibility, if unlicensed.
query	120	avoid violating your b1 business visa. conducting eligible activities. getting employment authorization. ending or extending your stay keep the letter from your employer. review the list of eligible activities. apply for a change of status. consult an immigration attorney. look over the criteria for an h 1b visa. have your employer file an i 129 petition. complete form i 539. submit your paperwork to the uscis. wait for a decision. make return travel arrangements in advance. make sure your passport remains valid. pay attention to the date your visa expires. get supporting documentation. file your application for an extension.
query	121	get a job at walmart. applying online. interviewing in store. standing out browse job openings. create credentials online. complete the application. complete the assessment. call the store you applied to. pass your first interview. go for a second interview. pass a background check. pass a drug test. keep your schedule open. go network in store. be very friendly. apply to multiple stores.
query	122	choose a college major. exploring your options. narrowing it down. making a decision do your research. ask for advice. find out how much time you have to declare a major. consider whether you re ready for college. trust your gut. think about your purpose. audit classes. declare a major. recognize that this decision may not be final. keep your eyes open. refine your major.
query	123	make an abraham lincoln costume. dressing like abraham lincoln. doing lincoln hair and makeup. exploring new costume ideas. acting like abraham lincoln find a black fancy overcoat. don a tall top hat.lincoln s look is associated with fancy clothes and a big top hat. wear black dress shoes. wear a black bowtie.lincoln was known to wear bowties. get a thick chin beard. wear a set of bushy eyebrows. get lincoln s gaunt cheeks with makeup. tousle your hair. accessorize your look. explore making your costume from different materials. try a babe raham lincoln costume.some women s costumes take the form of a  sexy  version of something. combine ideas from different costume sets. speak with civility and politeness. approximate lincoln s accent. talk using a tenor voice. watch the movie lincoln.
query	124	plant turing sunflowers. planting turing s sunflowers. ongoing care for turing s sunflowers. removing turing sunflowers. trying the turing sunflower experiment pick out a spot that is sunny and sheltered from the wind. consider using a heavy container. know that you might find a bit of a mess wherever you plant your sunflower seeds. keep the frost in mind when planting your sunflowers. prepare the area where you plan to plant your sunflowers. consider planting your sunflowers from seeds. plant your seeds. consider planting two seeds at once. give your tall sunflowers some support. water your sunflowers. protect your sunflowers from pests. fertilize your plants. consider leaving the dead sunflowers for the birds to eat. cut the old stalks back. get rid of seeds to prevent self seeding. become familiar with who alan turing was. learn how turing sunflowers came about. consider participating in the experiment.
query	125	use whisper. setting up whisper. browsing secrets. interacting on whisper download the whisper app from the app store or google play. allow whisper to use your location. set up your notification settings. set up your private profile. add friends or contacts from your phone, facebook, or twitter. scroll through the homepage. browse the latest whispers or whispers nearby you. tap  discover  to search for secrets. view replies to whispers. reply to a whisper. chat with others. create your own whisper.
query	126	install android on an htc hd. downloading prerequisite software. installing hs4pl. installing the radio rom. installing magldr. installing clockworkmod recovery. installing android download hspl4. download a radio rom and custom ruu. download magldr. download clockworkmod recovery. download the android os rom. prepare the downloaded files. power on your phone. connect the htc hd2 to your computer. run hs4pl. install hs4pl. power cycle your phone. run customruu. install the radio rom. run magldr. power cycle your phone into the magldr bootloader screen. run clockworkmod recovery. copy the android rom to the sd card. power cycle the htc hd2. reboot the phone.
query	127	play lego batman  the videogame. play through story mode. collect mini kits. collect power bricks. free the hostages. play the bonus missions.
query	128	formally address british royalty and aristocracy in person. addressing the british royal family. addressing british nobility greet royalty with a small bow or curtsy. consider a small nod or bob instead. shake hands only if the offer is extended. let the royal personage take the lead in conversation. use the full formal address in your first reply. use short forms of address for the rest of the conversation. repeat the same greeting when the royal family member leaves. contact the royal household if you have further questions. address dukes and duchesses by title. refer to all lower ranks by lady and lord. address the peer s children by courtesy titles. speak with baronets and knights.
query	129	meet ross lynch. attending an r5 concert. using social media. using other methods make plans to attend an r5 concert. get a backstage pass to the concert. join the r5 fan club. follow ross lynch on social media. read all posts and updates from ross lynch. contact ross using social media. attend a live taping of a show featuring ross lynch. contact local radio stations to find out if they re offering promotions or backstage passes to the next ross lynch event. use a booking agency to book an event or meeting with ross lynch. spend time at ross lynch s favorite venues. talk to people who work at r5 concert venues.
query	130	outlet pass. performing the pass. drilling passing with teammates jump to snag rebounded balls. glance down court. make long outlet passes to the area between 3 point and free throw line. draw the ball in close to your chin. land in a stable, wide stance. pivot to the outside and pass. separate participants into passers and outlets. position passers and outlets. have passers secure the ball. direct passes to land and pivot to the outside. complete the pass and rotate through players.
query	131	unlock the ecw storyline in wwe smackdown  vs. raw 200. do not play as big show, booker t, rey mysterio, rob van dam or spike dudley. play as eddie guerrero, john bradshaw layfield or kurt angle to unlock the storyline automatically. agree with rob van dam in  torrie s contract   week one . make sure john cena wins the special referee match between him and rob van dam. lose the triple threat match at judgment day. pick rob van dam as your partner. lose against booker t and kurt angle. refuse eddie guerrero s offer. lose the ladder match against eddie guerrero. choose the triple threat match. win the royal rumble.
query	132	get closer with god our holy father. steps. now that you know  about  him, get closer  realize  while being confident  that good and evil are opposite  and god and jesus love the world. consider why god started over the first time. understand how at a time later, god visited our earth, when joseph and mary  or maria  were engaged for marriage, and loved each other. look for hope  jesus did many miracles and taught people how to be blessed. pray every night. read the bible. be his friend  read john chapter3 and learn how god loved us all enough that he offered us eternal life through jesus and that jesus said we must be born of water and the spirit to be a part of this. acknowledge that you believe that jesus was born, lived and died for our sins, was resurrected and lives to intercede for us. promise to live your life for the lord, and go to church to fellowship  and share the good news more broadly as a witness to what god has done for you.
