query	1	overclock a graphics card. getting ready. benchmarking your card. raising your core clock speeds. raising your core voltage. testing your stability update your video card drivers. download your tools. research your card. open your benchmark program. adjust the benchmark settings. click run. click benchmark. record your score. open msi afterburner. find the  core clock  mhz   slider. raise the core clock speed by about 10mhz. click apply. run the benchmark program. repeat the  raise and benchmark  process. decide how to proceed. click the settings button in msi afterburner. increase the  core voltage  mv   slider by about 10mv. run your benchmark program. repeat part three. watch your temperature. increase your voltage again. don t go over your safe voltage. know when to quit. repeat the entire thing with your  memory clock  mhz   slider . overclock sli cards. start up your benchmark program. click the run button. watch for errors. get your game on.
query	2	begin bodybuilding. determine your goal. prepare yourself to start. get some help. get some knowledge. bodybuilding beginner challenges. consider these helpful tips. follow golden rules determine what your goal is. find a gymas a bodybuilding beginner you have to find a gym around your neighborhood and it will be much better if you can go to it by foot because it will help you to defeat all excuses about not going, and the gym atmosphere is a very important key for your success because it helps you to concentrate more which means better results for you . find a training partnerbodybuilding sport have a lot of challenges not every bodybuilding beginner can deal with it , in fact 90  of the bodybuilding beginner didn t achieve their goals whatever it is lose fat , build muscle , gain weight, become a fitness model, etc because they didn t have the amount of support and motivation all bodybuilding beginners really need. as a bodybuilding beginner you have to look for help. one of the most important you have to take as a bodybuilding beginner is knowledge. set high hopes. first week painwell , everyone of us have a daily activities his body used to do it continuously and when he add a new activity like bodybuilding sport, his body will suffer for a while from this new activity and you will feel some pain in your body, however it will quickly disappeared it will take almost one week only 3 training session, my advice is just be patient because all bodybuilding beginner pass this pain in one week only. food challengeevery bodybuilding beginner he or she have to change the way they eat , as we said before nutrition is a very important factor in any sport . facing injury challengemost bodybuilding beginner face this challenge. don t try any diet medicine to get fast results, ask your doctor first, because this is the most common fault almost all beginner female bodybuilders make and it may cause some injury to your body. keep energy high. track your progress. purchase necessary tools   it will give you a good support to reach your target . as a bodybuilding beginner, female or male you have to keep in mind these three rulestrain hardeat wellsleep well
query	3	develop alternative perspectives for decision making. conduct a brainstorming session. ask for input. imagine you are a different person approaching the problem. rephrase the problem. reverse the problem. change your scenery. employ all of your senses during the decision making process. read books on the subject you are evaluating.
query	4	keep smoking systematically without getting addicted. suppressing nicotine cravings. breaking or reducing an existing smoking habit. understanding how addiction works avoid nicotine triggers. distract yourself. delay and regulate your urges. use relaxation techniques. make time for a workout. try nicotine replacement therapy. have a support system. consider e cigarettes. visit nonsmoking places. know when to cut yourself off. learn the effects of tobacco. understand social smoking. determine if you are addicted. consider seeing a doctor.
query	5	get a venture capital investment. don t bother trying to get funding unless you already have something going, relevant experience and connections, and an edge that will make your business really grow and attract and retain customers. write a business plan and a formal pitch. be clear about the deal. apply only to vc s who have shown a willingness to invest in ideas like yours. have a business that demonstrates the power of the idea in action.
query	6	ombre hair. getting started. bleaching your hair. coloring your hair select your color. decide where you want the fade to stop. brush your hair well. put on a smock or an old t shirt. put on gloves. mix your bleach. divide your hair into sections. choose an application tool. begin bleaching your hair. let the bleach set. wash out the bleach. make sure your hair is dry. section off your hair once more. prepare your color. brush in your color. let the color set. wash out the hair color. dry and style your hair as usual.
query	7	react after a car accident. always keep an accident pack in the car. make sure you always have a pen and paper handy for any notes and insurance details you may need to take, and keep a disposable camera in the car for photos of the accident scene, which can help with any future insurance claim. always stop at the scene of an accident. make the accident scene safe by turning off your engine, turning on your hazard lights and alerting oncoming traffic to the accident. if anyone is injured, or the road is blocked, call 999 in the uk, 000 in australia, or 911 in the usa, and call out the emergency services. no matter who is at fault, try to stay as calm as possible. note down the names and full details of any witnesses to the accident, including passengers where possible. exchange details with the other driver involved, including, name, address, vehicle registration and his insurance company. make sketches, take notes and even videos of the scene where possible. make a note of additional information which may be useful, including factors which may have helped cause the accident. contact your insurance company as soon as possible to let them know about the accident, even if you do not intend to make a claim.
query	8	teach adults a foreign language. building  communicative competence . becoming familiar with theoretical approaches. trying a variety of classroom activities consider roadblocks to adult language acquisition. assess and assist learner motivation. facilitate student interaction. build vocabulary directly and  incidentally.  it is estimated that an adult needs to understand about 3,000 word families  think, thought, and thoughtful are in one word family, for instance  to be able to understand a foreign language from context.traditional vocabulary building methods, like memorization, drills, and tables, can still be utilized in the classroom with success. be flexible. compare classic and modern approaches. see the pros and possible cons of newer views. don t ignore traditional methods. find the right balance. let the adults be kids. help students help one another. offer goals and rewards. don t skip the work.
query	9	contest a divorce. resolving disagreements through mediation. contesting a divorce through the courts consider mediation before going to court. consider the disadvantages of mediation as well. suggest mediation to your spouse. find a mediator. call the mediator. attend the mediation meeting. make an opening statement. discuss your disagreements and come up with solutions. negotiate a mediation agreement. complete a mediation agreement. file a response. make at least 2 copies of your forms. file the forms within the time limit specified by the petition. pay the filing fee. serve your papers on your spouse and file your proof of service. hire an attorney. engage in discovery. engage in pre trial motions and hearings. try to settle the case. go to trial. appeal the decision.
query	10	improve your study routine with exercise. connecting exercise with studying. putting together an exercise plan. understanding the importance of combining exercise with studying exercise just before you study. try light exercise while you study. go to the gym right after studying. take a walk around the library. exercise at your desk. determine an appropriate amount of exercise. choose an aerobic exercise. make time for your workout. focus on consistency. make the exercise an enjoyable experience. know that exercise boosts mental function. exercise to reduce stress. incorporate exercise to improve energy.
query	11	make a funny movie spoof. nailing the writing. filming a great spoof choose a genre to spoof, not one specific movie. watch every movie and scene from the genre you want to spoof, taking notes. aim for the plot holes and start poking fun. invert the expectations and tropes of your film comically. push the  normal  of the movie you re parodying to its comical extreme. understand what makes the original so successful, underscoring or arguing its message. consider making an actor or actress the  straight man  to illustrate what is a joke and what is being taken at face value. don t rely purely on references to create laughs, instead using them as a jumping off point. breakdown the visual style of the movies you re spoofing, and shoot it similarly if possible. give your actors characters to reference for their performance. play the ridiculous moments  straight  for the funniest results. pay attention to costumes and set design, mimicking the original as much as possible to make it feel like a sequel. toss in visual jokes that mimic or mock the original. allow a little seriousness into the film to make the comedy hit harder. aim for a quick, high paced film, especially in comedic moments.
query	12	do fabric painting. prepping your fabric. choosing your materials. painting your fabric. adding embellishments select your fabric. wash your fabric to prevent unwanted shrinkage after you apply the paint. place a barrier between the front and back layers of the fabric. pin the fabric in place using safety pins or sewing pins. choose fabric paint from a bottle to achieve precise, textured lines. alternately, purchase fabric paint that you can apply with paint brushes. choose paint brushes according to the effect you want to create with your brush strokes. draw out your desired design on a piece of paper using a pencil. use a pencil or a disappearing ink pen to transfer your design to your fabric. switch to the painting tool of your choice and paint over the image that you just traced. to create a watercolor look, mix your paint color with water until it is the thickness of writing ink. to airbrush a stencil, use fabric spray paint. to create texture, use a combing tool. once you ve finished your design, let the paint dry for 24 hours and do not wash your fabric for 72 hours after painting. make your fabric sparkle with glitter. add three dimensional embellishments like rhinestones and buttons. cut a design out of a sponge using scissors and dip the soft side lightly into fabric paint.
query	13	learn japanese words. learning with  flashcards . make odd sentences. create connections between japanese and your mother tongue. learning by listening. learning by using use flashcards. take your first word. flip the flashcard. start practicing. our brain can keep words best for a long time when we put them in odd sentences or place them in an odd way into a sentence. choose a word. write a sentence. it happens that in japanese words you might see a part which looks like a word in your mother tongue. with this method you can not only learn new words, but also trim your hearing skills. turn on your computer and go to youtube. listen to the source you ve found. go to google translate or search in a dictionary this word. this is a really good way to actively work on your japanese skills and also try to get a feeling for new words. choose one japanese word and look at the translation. create at least 3 sentences with the japanese word. go on with the next words.
query	14	raise a girl as a single father. spend time with her. adversely, don t hover. identify problems and try your best to fix whatever they may be. understand that she will still miss her mother. let her be busy. focus on being a father. it might seem a bit weird when your daughter starts asking you to play with her barbie dolls alongside her, but you ll need to get used of it, as this will allow you two to bond. ask for help. talk about her mother. make her laugh.
query	15	watch a horror movie. preparing for watching the horror movie. during the horror movie read about the movie before you watch it. use what you ve read about the movie to decide whether or not you want to watch it. consider starting with the right level of horror movie. go to the bathroom before starting the movie, especially if it s at night. gather together some pillows and blankets to make a cozy area or even a fort. watch it with someone else. peek rather than watch. cover your eyes during the scary parts. peek through your fingers slowly, and then cover your eyes again. keep saying to yourself,  this is not real   watch the commercials on how the movies were made. when there is suspenseful music playing, brace yourself.
query	16	determine a film s genre1. thriller. other genres identify thrillers. notice any humor that has been thrown in as a sort of comic relief. determine if the protagonist and or his her allies are pitted against a powerful organization that typically only they know about. identify whether the suspense is psychological  made up of the character s own fears. notice whether the movie focuses on a spy and his endeavors against an agency. determine whether the suspense is generated from a supernatural force. evaluate whether there are robots or computers involved. determine whether the movie is a prequel. determine whether the movie is a sequel. determine whether the film is a classic. identify modern classics. determine whether the film is a cult classic. determine whether the movie could be a family film. notice whether the film is silent. identify non linear movies. do research and determine whether the movie originally came from a graphic novel. find out whether the movie originally was a comic, such the captain america, batman, superman, and x men franchises. find out whether the film originally came from a book, like no country for old men, american psycho, and unbroken. find out whether the movie originally came from a play, like waiting for godot and doubt. find out whether the film originated from a poem. find out whether the film originally came from a video game. find out whether the movie came from, or is based on, a tv show. determine whether the movie is animated. find out if the movie uses puppets. find out if the movie is a stop motion. decide if the movie is meta. decide if the movie is erotic. notice whether the movie tries to create feelings of extreme anxiety and has a plot based on a conspiracy theory. decide whether the film is an allegory, meaning it has a higher meaning, often secret. notice whether the movie is a comedy featuring african african american characters. notice whether the movie is an ultraviolent film. decide whether the movie is gothic. decide if the movie is noir. decide if the movie is neo noir. find out if the movie is a tv movie. find if the movie is a remake of an older one. notice whether the movie is a coming of age film. decide whether the movie is a musical. decide whether the movie is jiangishi. evaluate whether the film is a sports movie. notice if the movie is a biopic, or biographical picture. determine whether the movie is kaiju. determine whether the movie is a teen film. notice if the movie is a parody. find out if the movie is indie.
query	17	beat level 88 on candy crush. look for opportunities to create as many striped horizontal candies as possible. match candies in the isolated side columns at all times when moves are available. wipe out licorice swirl blockers only when they ll help you make matches that will clear jellies in the side columns. try to make striped candies in the bottom rows before trying to create striped candies in the top rows. detonate any color bombs you create using striped candies, if possible.
query	18	plan a road trip from san francisco to new york. think about which road you ll take. think about what sights you ll want to see. think about hotels. think about gasoline. think about money. prepare other supplies to bring.
query	19	ask a girl s parents for permission to date her. introducing yourself to her parents. asking their permission. proving you re responsible become a familiar, positive presence. talk to her parents in person. look nice. introduce yourself. let them lead the conversation. be polite but genuine. tell the truth. make sure they know their daughter wants to date you. talk to them about why you want to date their daughter. ask if you have their permission. agree to their conditions. keep your word. provide your contact information. avoid sneaking around. work hard in school.
query	20	record screen in microsoft windows 7. using obs studio. using screenrecorder go to https   obsproject.com in a web browser. click download obs studio. click windows 7 . double click the installer file and follow the on screen prompts. open the obs studio app. click the   in the sources window. select a source. make sure the  create new  radio button is pushed and click ok. select the correct screen and click ok. click start recording. click stop recording when you re finished. go to https   technet.microsoft.com en us library 2009.03.utilityspotlight2.aspx in a web browser. click utilityonlinemarch092009 03.exe at the top of the window. locate the downloaded file. double click utilityonlinemarch092009 03.exe. select a destination for the files. double click the extracted folder that corresponds with your operating system. run the screenrecorder app. run the screenrecorder app again. double click the screenrecorder shortcut on your desktop to open it. select the element you want to record. check the audio box to enable audio recording. decide if you want the border of your window to flash. click ok to open the recording tool. specify a name and file location. click the start to begin recording.
query	21	read shakespeare for beginners. selecting your text and preparing yourself. reading the text. going above and beyond select a play. choose a good edition. familiarize yourself with the most frequent  shakespearisms.  language is always evolving, and some of the words in shakespeare s plays have a different meaning today than when the plays were written, or they are no longer in use. understand shakespeare s use of grammar. enjoy shakespeare s wordplay. gather other resources you might need. read carefully and slowly. take notes as you read. reread the text. keep reading. take more notes after each section. discuss the text with friends. perform or speak the play. watch a play, a movie, or listen to audio recordings of shakespeare s work. read a plot synopsis.
query	22	search movie showtimes using spotlight search for iphone. open your iphone s settings. tap general. tap spotlight search. slide the button next to  suggestions in search  to the  on  position. swipe down from the top of your screen. type the title of a movie into the spotlight search bar. tap the movie title. scroll down to review information about the movie.
query	23	take care of a skittle dragon. make sure they are a skittle dragon and not a regular dragon. make sure you are ready for a skittle dragon. make sure you get one while it s young so you can make it think you are its parent. be faithful and never abandon your skittle dragon, because it will follow your for all eternity. feed it skittles when it cries. love them with all your heart and know they can never have enough skittles  if you ve done everything right they will love you with their life.
query	24	perform a striptease. set the stage. take it off pick the perfect outer garment. wear the right undergarments. put on a pair of killer shoes. have sultry hair. wear sexy makeup. dim the lights. put a chair in the middle of the room. prepare some sexy music. let loose. stride into the room like a professional. maintain a sexy expression. take off your top. remove your skirt. work your body. kick off your shoes and take off your stockings. put your shoes back on. take off your bra. take off your underwear. kick off your heels.
query	25	meet john cena. wwe events and opportunities. other possible opportunities. how to act and what to say attend an official event. watch any wwe show on television. send an e mail or letter. contact john cena using social media. connect to his record company. listen to the radio. attend a movie premiere. make a wish. express your enthusiasm. ask for an autograph or photograph. be on your best behavior.
query	26	say  i love you  in french, german and italian. in french. in german. in italian master the basics. practice, practice, practice. get creative. get the sounds right. put the whole phrase together. make it effortless. know the subtle differences. pick your phrase and get the pronunciation down. say it.
query	27	be christcore. read the bible. have passion for your faith. follow the rules. get the look. examples of christcore fashion include aaron gillespie of under ath, mike hranica of the devil wears prada, mattie montgomery of for today, and joel piper of confide. listen to the music. stand up  support a band. be a christian outside of christcore.
query	28	decide on what you ll be for halloween. dorothy from the wizard of oz. poltergeist witch. zombie princess cheerleader. mega man fan costume tell your parents about your dilemma. watch the wizard of oz with or without your parents or read the wonderful wizard of oz  either by yourself,or with your parents . go to ebay. buy some sparkly shoes. get a  real or fake  dog. do the normal stuff for a witch costume. get out long pieces of wire. find some small things. tie those things to the wires. tie the wires to your costume. glue a bunch of wires together, in different directions. don t forget the shoes  finish the costume with a trick or treat bag  know that this costume is basically three in one. get out some blue face paint. get a short sleeve shirt, a small skirt, and sneakers. don t forget the tiara  make one of your own robot masters  get the things you need and put them on.
query	29	add subtitles to a movie. downloading new subtitles. creating your own subtitles  three ways  know that you can only add subtitles to movies on your computer. find the movie you want to subtitle on your computer and put it in a separate file. search online for  your movie   language   subtitles  to find the right file. find the subtitles you want and download the .srt file. rename the subtitle file to match your movie file. put the .srt file in the folder of the movie. add .srt files to youtube movies you are posting by clicking  captions  while you upload. understand the goals of subtitling. use a subtitle creation website to efficiently add subtitles to any movie file. create own subtitles by hand using notepad. create subtitles in your favorite movie editor to avoid dealing with .srt files.
query	30	surprise someone on their birthday. surprising the person with gifts. surprising the person with activities write a note to the person. make the person a birthday breakfast. fill their space with balloons. make a birthday in a can. bake them a cake. collect letters from their loved ones. decorate their usual places in a theme. decorate the person s locker. plan a surprise party. schedule a day of fun. make a birthday in a box. surprise them with a picnic. take them somewhere they ve always wanted to go. host a surprise dinner. hire a limo.
query	31	use greenscreen on windows movie maker. set up a large green cloth on a wall. set up your camera either on a tripod or some other kind of support. film your movie for however long you like. insert your camera cable or memory card into your computer. open notepad from the accessories on the start menu. copy and paste this code into it   transitionsandeffects version  1.0   transitions  transitiondll guid   c5b19592 145e 11d3 9f04 006008039e37     transition name  greenscreen  iconid  11   param name  keytype  value  0     param name  rgb  value  0x00ff00      transition   transitiondll   transitions   transitionsandeffects  save it as  greenscreen.xml  into the folder  c  program files movie maker shared addontfx open windows movie maker. import your video of the green screen into windows movie maker. get the picture or video that you want to replace with the green. drag the green screen video into the timeline first, and then drag in the replacement background. drag in the greenscreen transition in between the two clips and stretch it to the length of both clips. watch your video to check if it is okay. have fun exploring the different ways of green screen.
query	32	catch ghosts. locating ghosts. confirming the presence of a ghost. catching ghosts look for ghosts in old houses. look for ghosts in cemeteries. look for ghosts in old schools. look for ghosts in old prison buildings. look for ghosts in former insane asylums. look for ghosts in former battlefields. look for ghosts at the site of a murder or accident. listen to local folklore. use a manual camera. use a camcorder. use a tape recorder. use an emf detector. use other specialist equipment. download a ghost hunting app. look out for any paranormal activity. use the box and burial method. use the candle method.
query	33	be a leading lady. be confident in yourself  be healthy  be sexy  leading ladies possess confidence, and know how to turn a man on with not only their body, but also with their brain. be happy  a happy woman is a lovely woman.
