query	133	listen to bach. start with his  air on the g string , one of his most famous and accessible pieces. then go with his  badinerie  from orchestral suite no. listen to  jesu, joy of man s desiring   if you ever went to a wedding, you already know this. go to the devilish  toccata and fugue in d minor   it is usually associated with horror scenes, but if you listen carefully you ll notice that isn t so bad after all. listen to the  brandenburg concertos   start with no. listen to the first suite for solo cello. listen to the concerto for two violins or double violin concerto  search for the movement  largo ma non troppo , it is one of bach s masterpieces. listen the other violin concertos. listen to his church cantatas bwv 1, bwv 25, bwv 41, bwv 78, bwv 82, bwv 140, bwv 191. listen to the orchestral suites. listen to the kyrie eleison from the mass in b minor. listen to the sonatas for violin and cembalo bwv 1014 1019. listen to the aria  erbame dich  from st. matthew passion. listen to the well tempered clavier and his keyboard works, the english and french suites. now you are ready to listen to his  heavier  works. listen the complete cello suites. listen to his sonatas and partitas for solo violin, these are probably bach s most profound and personal works. at this point you don t need any guide, you are an expert in bach s music.
query	134	keep up with a hipster. study his her hobbies, mannerisms and style. stay attuned to world events. study up on pop culture. ban all electronics except for your cell phone and computer.
query	135	grow orchids. potting your orchid. nurturing your orchids select a species of orchid. choose the right kind of soil for your orchids. try a potting mix, or combination of several different mediums. unless your orchid is a big plant, choose a snug pot for your orchid. if propagating seeds, be patient. pot your orchid. know when to re pot your orchids. create the right temperature for your orchid. make sure your orchids get enough sunlight, but not too much. water your orchid once every 5 to 12 days.it s easier to kill an orchid by watering it too frequently than by watering it too seldom. care for the orchids diligently. do not over fertilize your orchids. keep the humidity level up. understand that each orchid is different.
query	136	address the pope. addressing the pope in writing. addressing the pope in person address the pope as  your holiness.  maintain a respectful tone. conclude the letter politely. know the vatican mailing address. know the email address and fax number for the vatican press office. refer to the pope as  holy father.  other appropriate ways to address the pope in person include  your holiness  and  most holy father. stand and applaud as the pope enters. genuflect as the pope approaches. kiss his ring, when appropriate. speak respectfully, clearly, and concisely. stand up as the pope leaves.
query	137	stop waiting for prince charming. reassessing your priorities. working on yourself. meeting new people consider what  prince charming  means to you. ask yourself if your expectations are realistic. learn your non negotiables. compromise on your ideal partner. improve your confidence. develop new hobbies and interests. get out of your comfort zone. develop a life plan. approach strangers confidently. avoid being too picky. focus on chemistry. give a new guy a chance.
query	138	write a sports article. tackling your topic and style. shooting for a successful sports recap article. scoring with other kinds of sports articles know the type of article you are writing. consult good examples of sports writing. know as much as you can about the sport you are covering. think about the reader. go to the game, and make the most of being there. talk to people there. sort out the essential details. start with a great hook. flesh out the rest of the essentials. keep it concise. meet expectations. follow your passion. transport the reader. be a writer.
query	139	mix names. letter scramble. syllable reassembly. hyphenate separate names write out the letters in both names. pull letters from both sets to form names. return to the lists several times. break both names into syllables. combine different syllable sets. sort through the list. find two names you like. separate the two names with a hyphen. consider shortening one or both names.
query	140	care for a premature baby. ask questions. discover. interact. personalize. remember self care. prepare for homecoming. warnings speak to the professionals about the problems that your baby is facing. ask as many questions as you need to in order to completely understand the care that is being provided to your baby. request to speak with all of the doctors and nurses that are involved with your baby s care. discuss with the staff the possibility of nursing your baby if that was the course of action you had originally chosen. take the time to learn the procedures that are carried out in the nicu. learn about the various machines, equipment and alarms that are being used in the niccu. become as involved with the care of your baby as you can. speak to your baby. ask if you can change your baby s diaper. wash your baby with a warm cloth when possible. ask to hold your baby. offer to breastfeed your baby if he is able to nurse. ask about kangaroo care. speak up if you notice any changes in baby s physical or mental condition. bring special items from your home to make your baby s area more comforting. take time to care for yourself. maintain a healthy diet and continue taking your vitamins. get as much rest as possible to promote proper healing after the childbirth experience. expect to feel varying degrees of emotions. excuse yourself and take a break when you feel overwhelmed. allow others to assist you in any ways possible. get emotional support from others whenever you can. seek professional help if you find that you are becoming depressed or if you are having a difficult time handling your emotions and dealing with the stress of having a baby in the nicu. consider taking a course in cpr before bringing your baby home. expect to feel both excited and anxious when you bring your baby home. hire a professional to help in the home if you are very uncomfortable with the move from the nicu to your home. be sure to follow the directions of the professionals.
query	141	reduce tinnitus naturally. diagnosing tinnitus. talking with your doctor. trying acoustic therapy. trying alternative health treatments. trying supplements. changing your diet. finding support understand what tinnitus is. determine your risk factors for tinnitus. take the tinnitus handicap inventory questionnaire. get a diagnostic test from your doctor. talk to your doctor about age related conditions. mention your exposure to loud noises. ask your doctor about blood vessel disorders. ask your doctor if your medications might contribute to tinnitus. ask about other causes. visit your doctor if you suddenly experience symptoms. consider trying medical treatments for underlying conditions. ask about a hearing aid. use calming background sound. listen to soothing sounds as you fall asleep. try listening to brown or pink noise. avoid loud noises. look into music therapy. get a chiropractic adjustment. visit an acupuncturist. ask your doctor about aldosterone. try personalized sound frequency treatments. take coq10. try ginkgo biloba supplements. increase your intake of zinc. try melatonin supplements. avoid salty foods. eat a healthy, whole foods diet. try cutting down on coffee, alcohol and nicotine. try cognitive behavioral therapy and tinnitus retraining therapy. join a support group. see a mental health professional.
query	142	be like tony dinozzo from ncis. watch the show and study how tony dinozzo acts. be overly confident. flirt a lot. be afraid of commitment. keep yourself looking in top condition. be a bit of a prankster. be managerial. watch movies a lot. be loyal and caring.
query	143	become a diesel mechanic. prepare for a diesel mechanic career while still in high school. enroll in a college or vocational program that offers a diesel mechanic certificate or associate s degree program. obtain a state commercial driver s license or cdl. seek an employer that is willing to give you on the job training while you are working toward a degree. pass a drug test. apply for national certification from the national institute for automotive service excellence  ase .
query	144	make a phone call to mexico. gathering the necessary numbers. making the call find your international exit code. find the country code of the country you are calling. find the area code of area or city you are calling. know the local phone number, this is the phone number for the person, business, or cell phone that you are trying to reach in mexico. check the time of the place you are trying to reach. dial the complete international number. if someone answers by saying    bueno  
query	145	form a roda. form a circle lined with guests and players alike. set a place for the bacteria to sit. have the berraboi start the roda with seven strokes and the call of the mestre s voice. the lovasao will start the call and response of the roda. three beats into the lovasao is generally when the pandeiros will start seven strikes on the second note of a four note beat. sing the corridos    these running songs are packed with energy.
query	146	understand canadian slang. mastering canadian expressions and vocabulary. learning regional slang. practicing canadian slang study expressions that are uniquely canadian. study vocabulary that s unique to canada. learn words that have american or british english counterparts. learn the regions of canada. learn terms that are unique to the atlantic provinces. pick up phrases that are commonly found in central canada. study common slang from the prairie provinces. learn canadian slang from the british columbia. study slang from the northern territories. find a language buddy online. watch canadian movies. read canadian magazines.
query	147	remove stickers safely from a guitar. choosing your materials. removing the adhesive. polishing the guitar use commercial adhesive removers. consider other chemicals. mix coconut oil with baking soda. test the adhesive remover. remove as much of the sticker as possible using your fingernail. apply the adhesive remover. finish removing the sticker. remove any residual residue. wipe off the solution residue. dry off your guitar.
query	148	buy a bongo drum. purchase a bongo based on your skill level. choose between a wood drum or a fiberglass drum. select whether you would like synthetic or rawhide heads. select the style of head you want  flat or pre fitted. pick the size of bongo that suits you.
query	149	get around venice on the cheap. walk as much as you can. take advantage of water buses. invest in a vaporetto pass if you plan to be in venice for several days and you want to travel by water bus frequently. use traghetti to cross the grand canal. stay in budget accommodations. eat small, simple meals and avoid restaurants that cater to tourists. take advantage of free or inexpensive sights.
query	150	time your trip to cairo. know that cairo s peak season for travel is from october to may. consider a cairo trip during the summer low season if you don t mind the heat. pay attention to other aspects of cairo weather and climate when planning your trip. enjoy cairo weather during the brief spring from march to april  aside from the khamsin wind . protect yourself from cairo s pollution, which is the worst in autumn before the winter rains. pass up a cairo trip during school holidays if you plan on spending time on the mediterranean beaches north of the city. visit cairo with care during holidays. remain flexible if you visit cairo during the month of ramadan, usually beginning in early september. avoid travel to cairo during the holiday of eid al adha, which is held around dec. 8  many islamic holidays are determined by the lunar calendar .
query	151	enjoy attractions in cairo. making reservations. visiting historical sites. sites inside the city. moving beyond the city limits book a tour guidetour guides are typically egyptian translators, and will aid in travelling once you arrive in cairothey are relatively inexpensive to hire and very accommodatingmany tour guides will assist you in making further reservations for your trip, from hotels and transportation to tickets for events and monuments. find your ideal hotelmany hotels are very cheap right now as a draw for tourism, so it is easy to find classy resorts that offer incredible dealslook for hotels in the downtown, giza, or maadi areas of cairo. create your itinerarycairo is a busy city, knowing where you plan to go in advance is beneficial to maintaining a low stress level during your stayplan around the heat  cairo is located in the sahara desert and is very hot from the months of may october. the pyramids are the only remaining ancient wonders of the world, and are a must see for anyone stopping in cairo. visit memphis, the ancient capitol of egypt. see a necropolis and excavated ruins. there are several different religious sites that offer beautiful architecture and an excellent location inside of cairocoptic cairo is an area near the university of cairo famous for the seven churches   beautiful coptic christian churches that are free to the public for viewing. the khan il khalili is a major shopping bazaar piled high with spices, scarves, traditional egyptian clothing, and carvings from alabaster and camel bone. the cairo tower is the tallest building in cairo and offers a panoramic view of the entire city from the top. visit the nile for a day by renting time on a local sailboat or barge, and float along one of the most famous rivers in the world. drive three hours north to the largest city on the mediterranean, alexandria. three hours to the east of cairo is the red sea. head west from cairo for a few hours to reach the magical white desert.
query	152	write a position paper for model un. normal form. human rights topics. economic topics. health topics. war topics introduce yourself and your country. explain the topic and how it affects your nation. try to engage other nations to see and accept your position. once you have more common points, introduce your solutions. conclude by stating why this problem is so important. when talking about human rights, include one or two stories of violated rights. when talking about economics, mention your country s industries. when it comes to health, research is important. consider that war is a very sad and complicated topic.
query	153	become a licensed taxi driver in glasgow. eligibility requirements to become a glasgow taxi driver. obtaining a glasgow taxi driver license. additional requirements for employment with glasgow taxis limited review the eligibility requirements to become a taxi driver in glasgow. attend topographical courses on the city of glasgow, a requirement regardless of your intended employer. download and fill out the application to take the topographical test, available on the glasgow city council website  https   www.glasgow.gov.uk index.aspx articleid 4992 . pass the topographical test in order to proceed with obtaining your glasgow taxi driver license. download and fill out the application for taxi driver licensing after meeting the eligibility requirements. submit the application for taxi driver license and the necessary documentation by mail or in person to the licensing section, room 29, 235 george street, glasgow, g1 1qz. obtain a 1 year glasgow taxi driver license. agree to a criminal background check conducted by disclosure scotland. attend an interview at glasgow taxis limited. learn the dispatch system for glasgow taxis limited.
query	154	learn about ancient greece. the basic timeline. the basics of greek society. daily life be familiar with the basic time frame of ancient greece. consider the social structure of greece. explore the religion and mythology of greece. learn about the philosophy and science of ancient greece. explore the culture of ancient greece. learn about the cuisine of ancient greece. dress in the clothing of ancient greece. explore more facets of ancient greece.
query	155	get a free cell phone. acquiring a phone from your mobile carrier. getting a free phone through your employer. receiving a free cell phone from the government. finding other ways to obtain a free cell phone decide what features you want. check out at t s plans and phone selections. explore wireless plan options through verizon. look into sprint s service plan agreements that include free cell phones. determine if your work responsibilities justify having your employer buy you a cell phone. ask about communication subsidy programs at work. make a strong case for a company funded cell phone. apply for lifeline assistance. check out safelink wireless. apply for assurance wireless s free cell phone plan. take a look at budget mobile and see if you re eligible by applying online. ask someone close to you for a new cell phone as a birthday or anniversary present. ask someone for their old phone if they get a new one. enter raffles, sweepstakes, and other contests.
query	156	go trekking in the himalayas. do the necessary pre research  before, you plan to come, do your research on the region you would like to visit for trekking and for that you may take help through different search engines on the internet that will provide you information regarding the area, local tours and guides. know the region  the himalayan mountain chain is spread southeast to northwest across the asian continent. planning and preparation  the first and foremost part is that you like hiking in the first place  physical condition  when you are planning to trek in himalayas, it demands a degree of physical fitness in which muscles are conditioned to take the rigors of ascent and descent in long marches. mental condition  mental preparation is more complex than physical condoning. preparation for the trip  there are various factors to consider, both mental and physical, in preparation for the trip. food and fitness  first rule for anyone interested in trekking in the himalayan region is that one must be good in physical and mental condition. altitude sickness  no other mountains deserve the kind of respect the himalaya do in terms of altitude. the trekker medical kit  should include wound disinfectants, band aids in different sizes, gauze pads and rolls, mosquito repellents if crossing malarial areas, thermometer, analgesics, and anti inflammatory and other antibiotics as prescribed by a doctor from a travel clinic.
query	157	visit iran. do some intense research for accurate sources, whether they are travel companies or personal accounts. try to figure out the costs involved. try to contact the travel companies inside iran for better prices. if you are american, you need to go on a guided tour. chose where you want to go. buy a travel guidebook. book your hotels on the spot. use the bus. make a list of places you want to visit by looking up in internet. get a guide, if you need, by asking from your hotel reception. if you need a car, ask your hotel. try to improvise. accept the invitations that you might get from local people, if they invited you to their homes or restaurants. bring your cell phone and use it there  you can get local sim cards for  50. bring your laptop, if you really need it, but you should know that is going to be a hassle since there are tons of computers all over the place hotels, cafe nets, shops ...etc open a google mail and upload your photos as you travel into google by attaching them to a letter and send it to yourself. bring a slim camera, instead of a chunky one. dress conservatively. use lonelyplanet forum for asking your questions from people who already have traveled to iran.
query	158	be a kansas city royals fan. get yourself a royals jersey. watch the royals play baseball. here are some things and words to know the k. short for kauffman stadium  formerly royals stadium  where the royals currently play their home games. middle history. very recent history. support the royals no matter what 
query	159	make marshmallow desserts. marshmallow strawberry kebab. mini marshams. chocolate marshmallows. chocolate marshmallow lava cake.. roasted marshmallows melt the chocolate. put your strawberries and marshmallows on the kebab in a pattern. drizzle chocolate onto the kebabs. put a mini marshmallow on top of a toothpick. add a toothpick to the sides of the big marshmallow. draw a face on the marsham. cover your marshmallow in a chocolate spread. bake a chocolate cake. melt your compound chocolate. spread the chocolate into circles on parchment paper. cut a small hole in the middle of your cake. leave the regular melted chocolate to cool. cover the top of the cake with another chocolate circle. put your marshmallows in a bowl. put the marshmallows in the microwave for a minute. take the marshmallows out.
query	160	have a vacation in marco island, florida. know when to go. find somewhere to stay and book your accommodations. spend time enjoying the beach. live the nightlife. explore the island.
query	161	tour amazing montana sites. travel by car. visit in summer. visit flathead lake. play golf in montana. try snowsports in montana. choose to go either south along the interstate and big cities toward yellowstone or go east along the highline and rural towns toward mount rushmore. travel down to paradise hot springs and stay the night. check out downtown missoula and travel towards butte and fairmont hot springs. travel to bozeman and check out the downtown. travel toward north dakota. try visiting some museums. almost every small town has a local historical museum. dine locally. visit the world s largest earth dam. camp nearby. take the road down off of the dam and travel towards nashua. travel 35 miles  56 km  east from fort peck lake to visit the largest collection of john deer tractors. see the rodeo. keep going south.
query	162	visit melbourne. tour melbourne city. watch a football match. visit docklands, southbank, chinatown. the melbourne zoo is very fine. as with most australian cities, the beach is very popular. relaxing in a cafe is also a great thing to do. wondering the many laneways in the city. visit the melbourne museum. visit the melbourne visitors information centre at fed square. download local travel apps to navigate the city like a local.
query	163	find cheap flights to kenya. search for chartered flights. book separate flights. check out flying blue. time your trip. book a round the world ticket.
query	164	buy your way onto a mount everest expedition. comparing expedition companies and booking the expedition. preparing mentally and physically for the expedition contact experienced mountain climbing companies who have a strong track record on everest. discuss the supplies and services covered for the expedition. determine your budget for the expedition. compare the prices and services provided by several climbing companies. pay for the expedition and set your expedition date. follow a strict training program six months before your expedition date. focus on building cardiovascular strength and endurance. build muscle mass through free weights and interval training. do several big climbs before you commit to everest. enroll in an everest training camp. get the necessary gear for the climb.
query	165	deal with being framed in a foreign country. finding an attorney. navigating the court system. working through diplomatic channels contact your nearest embassy. get contact information for a local attorney. choose the best qualified attorney for your case. ask your attorney to explain the process. work with your attorney to prepare for trial. attend the trial. explore the possibility of immunity. find out if you can be extradited or deported. make a human rights plea to be released.
query	166	vacation in prague. arranging your trip. sightseeing around the city. enjoying the local culture organize your travel papers. book a flight. pick out accommodations that work for you. pack appropriately. make the journey by car. visit prague castle. see charles bridge. tour one of the many museums. take a stroll through old town. spend a day shopping in new town. sign up for a river cruise. enjoy good food and beverages. slow things down with a trip to the countryside.
query	167	choose a budget winter vacation destination. planning your budget. figuring out your priorities. picking the perfect spot look at your finances. create a savings plan. research vacation costs. talk to your travel partners. determine your activity level. think about your vacation goals. weigh the pros and cons of different climates. plan the length of your vacation. choose barbados. enjoy a cuban vacation. spend some time in the dominican republic. soak up the sun in ocho rios, jamaica. choose a mexican vacation. choose park city, utah. choose new york city. hang out in new orleans.
query	168	have fun in the cairngorms national park  scotland . visit the many lakes  locally known as lochs  across the park. climb the multiple mountains on offer. take a look at the variety of castles. ride the cairngorm funicular railway. walk through the delightful forests. try mountain biking. explore the waterfalls. visit the shows, theme parks and attractions. go skiing.
